title_english,content_english,link
Problem 789. “How to pacify a shark?”,"When catching sharks, Greenlandic Eskimos pull the predator onto the ice and quickly rip open its belly. But even after this, the shark in its agony poses a danger to people. How to quickly “pacify” her? Source(s): Around the World, 10/87, p.14",https://www.trizland.ru/tasks/5389/
Problem 790. “Volume of a light bulb”,"One day, a young man came to Edison to apply for a job. Edison gave him a test task - to determine the volume of a light bulb. How to do this? Source(s): Tekhnika - Molodezhi, 5/78, p.55",https://www.trizland.ru/tasks/5390/
Problem 793. “Fake painting”,"An Austrian museum decided to buy a painting by a famous artist in France. A group of French and Austrian experts examined the painting and were convinced that it was genuine; in their presence, the notary put a stamp on the back of the canvas certifying its authenticity. When the painting was delivered to Austria, one glance at the canvas was enough to see: the painting was a fake, although the print was in place. How did scammers bypass experts? Source(s): G. Altshuller. Find an idea. Novosibirsk, Nauka, 1991, p.89",https://www.trizland.ru/tasks/5393/
Problem 794. “Underwear for Puritans”,"In some states of the United States, the position of the Puritan religion is quite strong. They put one of the American companies specializing in the production of underwear in a rather difficult position. The company was deprived of the opportunity to demonstrate new models, because, according to Puritan canons, it is considered a sin to appear in public without outerwear. However, the company successfully overcame this difficulty. How? Source(s): Echo of the Planet, 24/92, p.38",https://www.trizland.ru/tasks/5394/
Problem 795. “Isn’t the tower sagging?”,"There is an ancient tower in the center of the city. There was concern that the soil under its foundation was subsiding. We need to check whether the tower really goes down. But the closest point about which we can reliably say that it is not subsiding is located half a kilometer from the tower and is blocked by other buildings. What is the simplest way to check whether a tower is settling? Source(s): G. Altshuller. Find an idea. Novosibirsk, Nauka, 1991, p.157-8",https://www.trizland.ru/tasks/5395/
Problem 796. “Smuggled vase”,"In an Italian museum, a historical value was stolen - an Etruscan vase. It was impossible to take her out of the country without documents. Obtaining documents is also illegal. And yet the vase was exported, and according to genuine documents. How was this accomplished? Source(s): G. Altshuller. Find an idea. Novosibirsk, Nauka, 1991, p.96",https://www.trizland.ru/tasks/5396/
Problem 797. “About turbulence”,"Recently, a wind speed and direction sensor was installed on the roof of a building, but due to the turbulence that occurs above the roof, the readings are becoming unreliable. As the wind increases, the situation becomes even worse due to increasing turbulence and the sensor stops working altogether.  You can increase the length of the pipe on which the sensor is installed, thereby removing it from the turbulence zone; in this case, the pipe must be long enough, and the likelihood of a lightning strike increases, and the appearance loses its aesthetics. It is not possible to move the sensor from the roof to another location. How can you get out of this situation?",https://www.trizland.ru/tasks/5397/
Problem 798. “Budinny against the Basmachi”,"In the 1920s, cavalryman and Red commander Semyon Budyonny suppressed the Basmach rebellions in Turkestan. The Basmachi often operated at night. And early in the morning, Budyonny’s detachment entered the village, and the army commander personally examined all the men and teenagers lined up. How did Budyonny determine which of the men was a Basmach? Source(s): B. Bochshtein. Entertaining Kremlinology. M, Stage, 1991, p.",https://www.trizland.ru/tasks/5398/
Problem 799. Camel racing,"Camel racing is extremely popular in Arab countries. During competitions, jockeys urge the camels on with furious shouts. Some camel owners at unofficial competitions resort to tricks and do without professional riders. How do they manage to urge the camels? Source(s): Echo of the Planet, 30/92, p.13",https://www.trizland.ru/tasks/5399/
Problem 800. Gluttonous Harvester ,"Before releasing agricultural machinery into the field, it is necessary to conduct bench tests. But the KSK-100 combine has a cutting drum with a productivity of 100 tons per hour, and the duration of continuous testing is several days. You can’t bring that much grass to the stand. Usually, in tests, leather waste was used instead of herbal mass, but there was nowhere to get it in such quantities. We tried using polymer “pasta”. After cutting, they can be restored in special extruder installations. But no installation can keep up with the shredder. What materials would you suggest using?",https://www.trizland.ru/tasks/1500/
Problem 803. “Baba Yaga bone leg”,"Baba Yaga, as you know, has two legs: one is bone, the other is simple. On a simple leg, Baba Yaga moves at a speed of 6 km/h, and on a bone leg - twice as fast. From the hut on chicken legs to the nearest store is 36 km. How long will it take Baba Yaga to cover this distance?",https://www.trizland.ru/tasks/1496/
Problem 804. “This is not a plain for you...”,Water tourists have noticed that on mountain rivers there is more raft draft than on flat rivers. How would you explain this?,https://www.trizland.ru/tasks/1497/
Problem 805. “The Mystery of Two Oceans”,"The levels of the oceans (Atlantic and Pacific) on different sides of the Panama Canal are different. In dry times the difference in levels is small, but in the rainy season it reaches 30 cm. How was this discovered? How to explain this? Suggest an experiment to prove your explanation is correct.",https://www.trizland.ru/tasks/1498/
Problem 806. “There may be a skew here...”,"When St. Isaac's Cathedral was being built in St. Petersburg, its builders were faced with a task: it was necessary to cut all the piles driven under the foundation strictly to one level. The chief builder of the cathedral, Montferrand, proposed...What would you suggest in his place?",https://www.trizland.ru/tasks/1499/
Problem 808. “Two stars fell”,Observing astronomers have noticed that meteors observed from midnight to morning shine brighter than meteors observed from evening to midnight. How to explain this? See. discussion of the problem in the forum,https://www.trizland.ru/tasks/1575/
Problem 809. “Rules of space traffic”,"Once upon a time, the famous space explorer Iyon Tikhy took an exam for his right to drive spaceships. The examiner, Professor Tarantoga, asked a simple question: “The spacecraft is in orbit around the Earth’s satellite. Can it orbit the earth twice as fast in the same orbit?” Iion Tikhy finds it difficult to answer this question. Tell him. See discussion of the problem in the forum",https://www.trizland.ru/tasks/1576/
Problem 810. “And then? Soup with a whale!”,"One day, fishermen discovered a dead whale on the seashore. When cutting up the carcass, it turned out that all the muscles of the whale were... boiled! How would you explain this? See. discussion of the problem in the forum",https://www.trizland.ru/tasks/1577/
Problem 811. Ocean of Air,What will happen to the atmosphere if the Earth's surface cools to -200°C? What will be the new parameters of the air envelope? See. discussion of the problem in the forum,https://www.trizland.ru/tasks/1578/
Problem 814. Tea Party on Baker Street ,"One day, Mr. Sherlock Holmes and Dr. Watson were drinking tea after another case. Holmes looked at the glass for several minutes without blinking, as if trying to discern something inaccessible to the eye of a mere mortal, and suddenly said: “I bet, Watson, you will never guess how much sugar you can pour into a glass of tea full to the brim.” . At the same time, note that you cannot spill a single drop from the glass. How much do you think? Try to check your guess. What did you observe? What happens to the density of tea in a glass? Does it increase, decrease, or remain the same? Dr. Watson asked Holmes to explain the illogical behavior of tea. Mr. Holmes was in difficulty, but still found an explanation. What would you answer to Dr. Watson?",https://www.trizland.ru/tasks/1581/
Problem 816. Tamed Bullet,"A military journalist published a note that he was an eyewitness to such a case: a man, without any harm to himself, grabbed a flying bullet with his hand. Could this be possible?",https://www.trizland.ru/tasks/1586/
Problem 817. “Shooting in a bar”,"Cowboy Billy, opening fire in a bar, hit a full bottle, an empty bottle, a hard-boiled egg and a raw egg. What happened to each of the targets?",https://www.trizland.ru/tasks/1587/
Problem 818. “Air seller”,Ostap Bender sells natural air from the Black Sea coast to Martians in sealed liter bottles. Martians give 100 g of gold per kilogram of air. Martians require a ton of air. Sending one bottle to Mars costs 1 mg of gold. Help Ostap Bender calculate his profit.,https://www.trizland.ru/tasks/1588/
Problem 819. “Eskimos look “beyond the horizon””,"Eskimos have long lived in the Far North. Everywhere you look there is an endless snowy desert. However, Eskimo hunters learned to look “over the horizon” to see prey or the nearest settlement. How did they do it? Source(s): Knowledge is power, 9/88, p.93",https://www.trizland.ru/tasks/5400/
Problem 820. “Fighting cocaine”,"In the remote highlands of Peru, there are illegal plantations of Erythroxylum coca, the Peruvian coca bush, from the leaves of which “natural” cocaine is made. Concerned about the spread of drugs, the country's authorities are looking for various ways to combat producers and dealers of the potion. Offer your options too. Source(s): Knowledge is power, 10/88, p.26",https://www.trizland.ru/tasks/5401/
Problem 822. “Fire in the theater”,"During the time of Queen Victoria, at a performance in one of the English theaters, a visiting magician accidentally set the curtain on fire. A fire started and panic arose, which only the orchestra conductor could stop. How?",https://www.trizland.ru/tasks/5403/
Problem 823. Diving ,"In diving competitions, athletes need to see the surface of the water in the pool to coordinate their actions in flight. How can this be done?",https://www.trizland.ru/tasks/5404/
Problem 824. “Answer to Alexander”, 1972,https://www.trizland.ru/tasks/5405/
Problem 825. Daring Ladies , 1992,https://www.trizland.ru/tasks/5406/
Problem 827. Fighting with Rocks, 1972,https://www.trizland.ru/tasks/5407/
Problem 828. “Royal amnesty”, 1975,https://www.trizland.ru/tasks/5408/
Problem 829. “Unfashionable suit”, 1989,https://www.trizland.ru/tasks/5409/
Problem 830. “How to deceive a piranha?”,"Piranhas, predatory freshwater fish that also feed on warm-blooded animals, are widespread in the waters of South America. But Brazilian shepherds have learned to drive herds of cows across rivers with piranhas with minimal losses. How do they do it?",https://www.trizland.ru/tasks/5410/
Problem 831. Initiative sectarians,"Members of one new religious sect asked the judge to allow them to crucify their spiritual father, who declared himself the newly-minted messiah and consented to the crucifixion. What verdict should the judge make?",https://www.trizland.ru/tasks/5411/
Problem 834. “How to drive people into a mine?”,"At the end of the 19th century, industrialist Siemens began developing copper deposits in the Caucasus. But local men did not want to work in the mines, since they received everything they needed from subsistence farming and did not need money. What solution did Siemens find?",https://www.trizland.ru/tasks/5414/
Problem 835. “Two Dwarves”,At the crossroads of two roads there are two gnomes. One of them always tells the truth. The other one always lies. You don't know which one is which. (And they know). You don’t know which of the two roads leads to the goal. (And they know). You can find out which path you should take by asking just one question to just one gnome. What kind of question is this?,https://www.trizland.ru/tasks/5415/
Problem 836. “Doctor-Prophet”,"One doctor from a small American city was famous for his predictions of the gender of the unborn child. At the same time, he wrote down his prediction on the calendar. And although they tried to catch him making a mistake many times, the entry in the calendar in such cases proved him right. What was his secret?",https://www.trizland.ru/tasks/5416/
Problem 838. Ancient Roman hygiene ,"During the period of the Roman Empire's power, the inhabitants of its capital could not cope with the problem of hygiene for a long time. People urinated right in the streets: on the walls of houses, on monuments. Therefore, a pungent stench was a common thing for Rome. Representatives of the city authorities - the aediles - racked their brains over how to put an end to this disgrace, and came up with a very original solution. What did the aediles come up with?",https://www.trizland.ru/tasks/5418/
Problem 839. “In confirmation of love”,"A young man, walking with a girl in the mountains, decided to confess his love to her. But she didn’t believe him and offered to jump off a cliff as proof of the strength of his love. After the young man answered, they hugged and went downstairs. What did the young man say?",https://www.trizland.ru/tasks/5419/
Problem 840. Lot-meter,"To measure depths up to 50 m, the marine fleet uses a sea lot. It is a lead or cast iron weight attached to the end of a cable. The weight is in the shape of a truncated pyramid with a depression in the lower base. Using the lot, you can measure not only the depth, but also the composition of the soil on the seabed. How?",https://www.trizland.ru/tasks/5420/
Problem 841. Smart devices ,"NASCAR formula racers determine the condition of their car during a race using instrument readings. However, there are quite a lot of instruments on the board, and it can be difficult for a rider to read all the instruments at once. To make life easier for the driver, the designers found a simple solution that allows the driver to determine, at one glance at the instruments, what exactly is in order in the car and what is not. What kind of solution is this?",https://www.trizland.ru/tasks/5421/
Problem 842. Princely measurements,"One of the Russian chronicles records that in 1028, Prince Gleb Svyatoslavovich measured the distance between Crimea and the Taman Peninsula. How did he manage to do this without any measuring instruments or tools?",https://www.trizland.ru/tasks/5422/
Problem 843. Soldier's pay ,"The English official Herschel was in charge of paying the salaries of Indian soldiers from 1862 to 1877. Even at the beginning of his service, he was faced with the following problem: all the soldiers looked alike to him, a European, most of them were illiterate, so it was difficult to say for sure that the soldier was already receiving a salary. Many soldiers took advantage of this. How did Hershel get out of this situation?",https://www.trizland.ru/tasks/5423/
Problem 845. Alexander the Great and the Rabbis ,"In each conquered country, Alexander the Great demanded the construction of a monument to himself. Having conquered Judea, he demanded the same. The rabbis objected, since the erection of monuments to people was contrary to the Jewish religion. But still, they found a way to perpetuate the name of the commander, which satisfied Alexander the Great. What did the rabbis come up with?",https://www.trizland.ru/tasks/5425/
Problem 846. Secret Copy,"Russian scientist, engineer, inventor, shipbuilder Alexey Nikolaevich Krylov (1863 - 1945) studied at the Naval School in his youth. Then, exam papers for the naval cadet corps were printed the day before the exam in the school’s printing house by one officer, who was supposed to be assisted by two students. These assistants were not allowed to take absolutely anything unnecessary with them into the printing house. They were even searched at the exit so that they would not take away the prints or the proofs themselves from which the questions were printed. However, despite this, Krylov, who turned out to be one of the officer’s assistants, came up with a way to copy the proofs. How did he do it?",https://www.trizland.ru/tasks/5426/
Problem 847. ““Competent” robbery”,"At the end of the 17th century, a French expeditionary force captured the Spanish city of Cartagena on the northern coast of South America. After the capture, the soldiers began to plunder the city, including churches and monasteries. And in order for the invaders to quickly find the treasures hidden by the Spanish monks, the commander of the French corps, Baron Puenti, gave the corresponding order to his subordinates. What did Pointry order?",https://www.trizland.ru/tasks/5427/
Problem 848. “Football in Polynesia”,"Tuvalu is an island nation in Polynesia located on the Funafuti Atoll. The land area is only 26 sq. km.  Communication with the “mainland” - ships by water and planes by air. The state is home to about 13,000 people. At the same time, Tuvalu has its own national football team, which participates in the World Cup and the Olympic Games. However, due to the limited territory on the island, it is not possible to build a full-fledged football stadium. How did the islanders get out of this situation?",https://www.trizland.ru/tasks/5428/
Problem 849. “You cannot have mercy on murder”,"In ancient times in Turkey, a young man stole a chicken. He was caught and taken to the Sultan. The Sultan offered the young man to kill the chicken, but on one condition: the executioner would take the young man's life in the same way the young man killed the chicken. But the young man managed to stay alive. What did the young man do?",https://www.trizland.ru/tasks/5429/
Problem 850. “Learn about the life of nomads”,"Tourists in foreign exotic countries often want to learn as much as possible about the local population. In Yemen, where a large number of nomadic tribes live in the deserts, they have found a very original way to do this, with the help of which tourists fully understand not only the culture and customs of the local population, but also the laws of hospitality. How do nomadic tribes introduce tourists to their way of life?",https://www.trizland.ru/tasks/5430/
Problem 852. “Are Boa Constrictors Dead?”,"At the end of the 19th century, one captain brought two boa constrictors to Hamburg. When the buyer climbed onto the deck of the ship, it turned out that the snakes were lying motionless in the box. The captain thought that the snakes had died. But when he returned an hour later, he discovered that the snakes had disappeared. Explain the situation. Propose and justify your hypotheses.",https://www.trizland.ru/tasks/1690/
Problem 853. “Scuba diver on fire”,"A real incident that occurred in 2000: at the epicenter of a large forest fire, firefighters found the body of a scuba diver wearing fins and a mask. Can you imagine how taken aback the firefighters were? How did he end up there? Propose hypotheses",https://www.trizland.ru/tasks/1691/
Problem 854. “Shoot chickens”,"NASA came up with a cannon that was loaded with chicken carcasses and fired at airplane windshields. The charge was calculated so that the speed of the chicken corresponded to the speed of the aircraft during takeoff/landing. This is how they tested the strength in a collision with birds during takeoff and landing. The British learned about the tests. We bought a gun. And they began to test their high-speed train. Shot. The chicken breaks the especially strong glass into fine dust, breaks through the instrument panel, knocks down the driver's chair and tests the strength of the rear wall of the cabin. Can you imagine the feelings of the experimenters? And we need to figure out what happened? Shall we help the British? Express your versions.",https://www.trizland.ru/tasks/1692/
Problem 855. “What does a woman look like?”,One woman once criticized a Matisse painting: “I’ve never seen a woman look like that!” How did the artist react?,https://www.trizland.ru/tasks/1693/
Problem 856. “Spit or not?”,"A famous actress, hysterical, shouts to the director: “I know you are just waiting for my death; to go and spit on my grave! How to answer the director, given that the actress did this in public and this is not the first time she has become hysterical?",https://www.trizland.ru/tasks/1694/
Problem 857. Old Man Hall ,"The famous American physicist Hall, while still a student, discovered the effect named after him. A few years later, when the effect became available in textbooks, Hall was invited to one of the physics congresses. Many participants at the convention, introducing themselves to Hall and paying attention to his youth, inquired: “Tell me, are you a relative of old Hall?” What would you do if you were Hall?",https://www.trizland.ru/tasks/1695/
Problem 858. “So much money in two hours?”,"An American millionaire, having bought a painting from the famous English artist Turner, learned that this painting, worth 100 pounds, took the artist only 2 hours to paint. The buyer was outraged and sued Turner for deception. The judge asked the artist, “tell me, how long did you work on the painting?” Help the artist answer.",https://www.trizland.ru/tasks/1728/
Problem 859. “Do bores bother Voltaire?”,"One day, a young man really bothered Voltaire with his questions. Every day he met Voltaire and “stuck” to him with his questions, taking up a lot of time. What to do? You can't get rid of a bore that easily. Shall we help Voltaire?",https://www.trizland.ru/tasks/1696/
Problem 860. “Erase  from the face of the earth”,"In ancient China, Emperor Jiaqin was so outraged by one crime that he decided not only to execute the criminals, but to wipe off the face of the earth even the place where the execution took place. How can this be done? Source(s): The Life and Teachings of Confucius, Moscow, Art, 1995, p.66.",https://www.trizland.ru/tasks/5431/
Problem 861. “What did your husband buy for you?”,"Three friends are talking. One says: “My husband bought me a new color Japanese TV.” Okay, I'm sitting at home and watching everything. - And he bought me a VCR. There is no need to go anywhere - just sit and have fun. - What did your husband buy for you? - they ask the third.",https://www.trizland.ru/tasks/1698/
Problem 862. “Traffic police for frogs”,"Latest news! Frogs on the roads. Entire colonies cross the road. And they die under the wheels of cars - a mountain of frogs with a total weight of... twenty tons died in a year! And where and why? In Buckinghamshire in the UK. There they built a highway between two large lakes, which cut the frogs' domain in half. Frogs can no longer calmly wander from pond to pond and lay eggs where they are used to always doing this. Probably, you can build a fence along the highway. But it's expensive. How can we help the unfortunate tree frogs? By the way, how can we help other animals and insects? A huge number of living creatures - hedgehogs, small predators - die under the wheels of cars, and billions of insects die on the windshield of a car. Note According to Canadian zoologists, who for a number of years have studied the level of attentiveness of domestic animals when crossing the highway, geese are extremely rarely hit by the wheels. They are the ones who take the lead in this regard. Further, the list of the most “disciplined” looks like this: pigs, chickens, cats, dogs. By the way, among the latter the most inattentive are spaniels and lap dogs.",https://www.trizland.ru/tasks/1699/
Problem 863. “Russian merchants against English merchants”,"In the 18th century, Russian merchants fought with English merchants for trade in the Persian market. Mostly sugar was brought to Iran, and carpets were exported. Once the Astrakhan merchant Grigory Safrazovich Khodzheminasov, whose name was simply Safras, also brought a whole shipload of sugar. But it turned out that there were already three English ships in the port with the same cargo. The British set their price at 10 Iranian tomans for a product that was of lower quality. A price fight has begun. And Safras managed to outwit his competitors, sell his sugar for 11 tomans and earn significant money from the trade. How did he do it?",https://www.trizland.ru/tasks/5432/
Problem 864. Skis with brakes,"A considerable number of injuries that beginner skiers get are due to the fact that they accelerate too much and are unable to brake in time. It is probably not only a matter of skill - after all, the skiers are beginners. But also of the skis, and of the slope itself and its surface. Maybe of something else? So how can you brake in time?",https://www.trizland.ru/tasks/1701/
Problem 866. Bandaging Magpies ,"A park of one of the schools in the Australian city of Brisbane was chosen by magpies. At first, everything went well - children and magpies got along well together. But then the magpies hatched chicks, and the birds became very aggressive: they pounced on everyone who passed by from behind, saving their offspring. Do you understand the state of children, teachers, parents? Horror! And the decision to match. The indignant parents, tired of meeting crying children, decided to exterminate the magpies. No magpies - no problem! But it was a very cruel proposal. However, a good solution was found by the animal protection society. Which one? Let's look!",https://www.trizland.ru/tasks/1730/
