title_english,content_english,link
Problem 392. “The squad of a noble citizen”,"One noble citizen of Athens passionately wanted to become the master of Attica. But power in Athens will not be handed over to him just like that. You can, of course, seize power by force, but according to existing laws, no citizen has the right to have his own squad. And without a squad it is impossible to capture the Acropolis. (Whoever owns the Acropolis was the master not only of Athens, but of all of Attica). How to be a noble citizen?",https://www.trizland.ru/tasks/1556/
Problem 393. “Bootleggers and Customs”,"Bootlegger - there's so much in this word. America. Prohibition times. Bootlegging flourished - the importation of smuggled alcoholic beverages into the country and their trade. Liquor was delivered to America by sea, but the ships were often subject to customs inspection. If illegally transported goods were discovered, strict punishment followed. There is contraband goods on the ship, and the customs service ship will overtake the smugglers' ship in 5-10 minutes. How to be a bootlegger? You can, of course, drown the goods, but then you will suffer losses. Leaving the goods on the ship is guaranteed to incur severe punishment.",https://www.trizland.ru/tasks/1511/
Problem 394. “Method for producing ethylene oxide”,"The oxidation process with the participation of a catalyst is accompanied by the release of a large amount of heat. With existing technology, the reaction occurs on a small grid area with a catalyst, where it is in contact with the raw material. 2 C2H2 + O2 =(kat, t)=> 2 H2C---CH2 + Q \O/. Large heat release with a large supply of reagents and high productivity of the apparatus can lead to overheating and an explosion. Therefore, it is necessary to make large-sized systems of complex structures in order to disperse and remove excess heat. How can you change the method of producing ethylene oxide in order to obtain a lot of the target product (ethylene oxide) in the same small-sized reactor and avoid overheating? Source: Sat. CRISIS - CNTI, 1992, p. 107.",https://www.trizland.ru/tasks/5172/
Problem 396. “New signs”,"In one city, a new district of 100 houses was built. Sign makers made and brought a pack of new signs with the numbering of houses from 1 to 100. Count the number of all the numbers 9 found in these signs (numbers 9 and 6 are different numbers). Source: Creative association “Flight of Thought” (Chelyabinsk)",https://www.trizland.ru/tasks/5173/
Problem 397. “Pharaoh “Narmer”,"Who among the greats of this world would not want to leave their name in history. Five thousand years ago, a pharaoh named Narmer ruled in Egypt. He won many victories and wanted these victories to be forever etched in stone. Skilled craftsmen depicted the pharaoh and the killed enemies and captives. They even showed with the help of drawings that there were six thousand prisoners. But they could not convey the name of Narmer himself. And for him this was the most important thing. After all, there was no writing then, only drawings and hieroglyphs. How was it possible to preserve the name of the pharaoh through the centuries?",https://www.trizland.ru/tasks/1656/
Problem 398. “Stamp with an error”,"In 1962, the US Postal Service issued a stamp commemorating the anniversary of the death of UN Secretary General Dag Hammorskjöld, who died in a plane crash. In a small part of the circulation, the yellow background of the stamp turned out to be upside down. These stamps fell into the hands of Leonard Herman, who was going to make good money from this. How did the postal administration prevent his plans?",https://www.trizland.ru/tasks/1605/
Problem 399. “Dirty and clean air”,"Exhaust gases from excavators and dump trucks accumulate in quarries.  There is a known method of ventilating quarries, in which dirty air is heated so that it becomes lighter and rises. However, heated air mixes with cold air, and this reduces the effectiveness of ventilation. How, while maintaining the previous method, can we reduce the mixing of hot dirty and clean cold air? Source: Creative association “Flight of Thought” (Chelyabinsk)",https://www.trizland.ru/tasks/5174/
Problem 400. “Hydrogenation of acetylene on catalysts”,"The process of selective hydrogenation of acetylene in the ethane-ethylene fraction occurs on catalysts with the release of a large amount of heat: H2C = CH2 + HCCH + H2 = (kat; t) => H2C = CH2 + Q. During the process, the temperature in the catalyst bed increases significantly and unacceptably. The temperature difference reaches 40-60 ° C. Known catalysts have a selectivity temperature range at which the required degree of purification from acetylene is achieved, no more than 15-25 ° C. Therefore, large losses of ethylene are observed (with the formation of ethane). The construction of reactors with intermediate cooling greatly complicates the reactor and increases the cost of the process. How to improve the process to reduce the temperature difference and increase selectivity? Source: Coll. KRIZ - CNTI, 1992, p. 107.",https://www.trizland.ru/tasks/5175/
Problem 402. “Footballers also love Whiskas”,"In the early 1990s, the Whiskas company signed a long-term contract to advertise its brand with the then successful football club in the Australian city of Geelong. Fans called this team the “Geelong Cats” - “Geelong Cats”, which was to the benefit of the global pet food manufacturer. But over time, luck left the “cats”. They began to play worse. The stands were empty during their matches. The cost of television broadcasts was falling. And Whiskas urgently demanded that team captain Harry Hawking either advertise his brand or return the money. And then the consultants of the “cats” came up with an idea, thanks to which, in just one season in 1999 and with almost no costs, debts to sponsors were reduced by $50,000. How did Hocking’s team manage to do this? In the early 1990s, the Whiskas company signed a long-term contract to advertise its brand with the then successful football club in the Australian city of Geelong. Fans called this team the “Geelong Cats” - “Geelong Cats”, which was to the benefit of the global pet food manufacturer. But over time, luck left the “cats”. They began to play worse. The stands were empty during their matches. The cost of television broadcasts was falling. And Whiskas urgently demanded that team captain Harry Hawking either advertise his brand or return the money. And then the consultants of the “cats” came up with an idea, thanks to which, in just one season in 1999 and with almost no costs, debts to sponsors were reduced by $50,000. How did Hawking's team do it?",https://www.trizland.ru/tasks/5720/
Problem 403. “Is the wastewater clean?”,"Wastewater from workshops using chemical technologies is very dangerous for wildlife. The plant went to the expense of installing filters that clean wastewater well. But the local community still does not want to believe in the purity of the wastewater, despite the plant’s informational efforts. How can a plant prove that it is right?",https://www.trizland.ru/tasks/1342/
Problem 404. “Oxidation of nitric oxide”,"Oxidation of nitric oxide(2) with air is technically simple and cheap. However, the resulting nitrogen dioxide is highly diluted with atmospheric nitrogen. The low concentration of nitrogen dioxide does not allow the production of high concentration nitric acid (63% acid is formed in the conventional process). The use of pure oxygen greatly complicates and increases the cost of the process: 2 NO + O2 => 2 NO2. Suggest a simple way to obtain concentrated (100%) acid. Source: Sat. CRISIS - CNTI, 1992, p. 108.",https://www.trizland.ru/tasks/5178/
Problem 405. Balls at Customs,"The customs officer, where the control of goods sent abroad was carried out, seemed suspicious to plastic skittle balls from one of the companies. They weighed the same as wood of the same size. The balls were not massive, but the walls were equally hard everywhere. The employee thought that inside each ball there was a cavity where contraband goods could be hidden. And, indeed, using a very simple experiment without the use of special equipment, the customs officer established that contraband was hidden in one of the 12 balls. When the ball was opened, it turned out to be a diamond jewelry. How did you manage to discover this ball? Source: Creative association “Flight of Thought” (Chelyabinsk)",https://www.trizland.ru/tasks/5179/
Problem 406. “Artificial leg”,"When using prosthetic legs, it is very important that the artificial leg is exactly like the other, living one. It would seem that this is not difficult to do - take a cast of a living leg and cast an artificial one on it. But it doesn’t work out that way, because no one needs two left or two right legs. What to do? Source: Creative association “Flight of Thought” (Chelyabinsk)",https://www.trizland.ru/tasks/5180/
Problem 407. “Coke deposits on catalysts”,"The production of benzene from its less valuable alkyl derivatives is carried out by the hydrodealkylation reaction - by reaction with hydrogen: CH3C6H5 + H2 = C6H6 + CH4. The process is carried out at a temperature of 700-800°C without a catalyst under a pressure of 20-70 atm (2-7 MPa). The disadvantage of this method is the use of expensive heat-resistant steel grades. During the process, coke is deposited on the reactor walls, which reduces the heat transfer coefficient, so the temperature of the reactor walls has to be increased more so that the reaction mixture reaches the required temperature. The use of catalysts containing chromium or noble metals allows the temperature to be reduced by 100°C. But coke is also deposited on the catalysts (as a result of a side reaction). Coke deposition deactivates the catalyst. To regenerate the catalyst, the process is interrupted, the reactor is cooled, blown with cold air to remove hydrocarbons, the coke is burned off by blowing hot air, cooled, blown with hydrocarbons, heated again and the process is continued with the activated catalyst. How to simplify the process and/or deactivate the catalyst? Source: Sat. CRISIS - CNTI, 1992, p. 108.",https://www.trizland.ru/tasks/5181/
Problem 408. “Preparing paint”,"In order to get orange paint, you need to mix yellow paints (6 parts) and red paints (2 parts). How many grams of orange paint can you get (maximum) if you have 3 grams of yellow and 3 grams of red paint? Source: Creative association “Flight of Thought” (Chelyabinsk)",https://www.trizland.ru/tasks/5182/
Problem 409. Aviation patrol,"One of the types of aviation combat operations is to cover one’s advancing troops from possible enemy bombing. Fighters cover the troops, flying at low altitude and low speed, so as not to waste a lot of fuel. But when the enemy appears, they find themselves in a very disadvantageous position: they do not have a headroom and high speed, which is very important for the success of the battle. But you can’t patrol at high altitude: you might not have time to cover the troops. What to do? Source: Creative association “Flight of Thought” (Chelyabinsk)",https://www.trizland.ru/tasks/5183/
Problem 410. Battle of the Lorians ,"Space pilot Johnny Bezic ends up on the planet Loris, where relations between people are close to ideal. It was a real paradise: a highly developed civilization, the highest level of technology. It turned out that between the civilizations - Loris and Earth - there would inevitably be a clash in the struggle for dominance. The battle is inevitable. The level of technology leaves no doubt about the victory of the Lorians. But psychology is also very important. Lorians are straightforward and honest people. Earthlings are aggressive, unbalanced and capable of any treachery. Therefore, the Lorians will not be able to psychologically resist the earthlings. And, as a result, their defeat. But the Lorians find a way out and successfully solve the problem. What exactly did they do?",https://www.trizland.ru/tasks/1740/
Problem 411. Take off your hat ,"One American cinema began to burn out. It turned out that the audience was unhappy that during the film show the ladies did not take off their hats, blocking the screen. And what did the cinema administration not do? They posted a notice in the cloakroom and asked over the loudspeaker to be polite - the result was zero. How to get stubborn ladies to take off their hats during a movie show?",https://www.trizland.ru/tasks/1343/
Problem 412. “The way to a judge’s heart is through his stomach”,"The partner filed a lawsuit against Pinhus. There was a trial coming up.
- What do you think, Mr. Lawyer, can I send the judge a goose as a gift?
- God forbid. This would be an attempt at bribery, and you will lose the case.
Pinchus won the case. And he said to the lawyer, smiling:
- I still sent the goose to the judge!
- Really? How then can we explain Pinchus’ victory?",https://www.trizland.ru/tasks/1344/
Problem 415. “Rothschild and Baku Oil”,"By the end of the 19th century, the development of the oil industry in Russia required a lot of funds. Drilling a well for 100 fathoms cost a huge amount of money at that time - as much as 10 thousand rubles. Where could I get them? There were no government subsidies then. The loan was expensive. And in the mid-80s of the last century, the Western European entrepreneur and financier Rothschild appeared for the first time. He offers Baku oil industrialists loans on fabulously easy terms - only 3% per annum, although all loans at that time were given at a higher interest rate. Agree, Rothschild knew how to count and make a profit. Why did he offer loans at 3% per annum?",https://www.trizland.ru/tasks/1426/
Problem 416. “South Korean gasoline”,"For the successful development of the oil refining industry, the following are needed: a constant source of raw materials - refined oil at relatively low prices - and cheap capital. The South Koreans have neither one nor the other: Korea has never had its own oil and is not expected to have it, and obtaining large loans is also problematic. But the Korean oil refining industry is developing very dynamically. What do you think, due to what?",https://www.trizland.ru/tasks/1427/
Problem 418. “Shrines of the Temple of Apollo”,"Fearing a Persian invasion, the inhabitants of Delphi turned to the oracle with the question: what should they do with the shrines of the Temple of Apollo? Where to hide? It was difficult to remove valuables. How to save valuables?",https://www.trizland.ru/tasks/1447/
Problem 419. “I want to go on stage”,"Louise Deutsch from Washington for a long time dreamed of performing with local rock bands, although she herself could neither sing nor play any instruments. How can a girl make her dream come true?",https://www.trizland.ru/tasks/1346/
Problem 421. “Cleaning wet ash collectors”,"When coal burns in the furnaces of steam generator boilers, ash is formed, which is captured by water. However, these wet ash collectors (due to the presence of sulfur in the coal) also produce very slightly soluble calcium sulfite. Its solubility in water is less than 1 mg/l. Whereas calcium sulfate has a solubility of 500 mg/l. This sulfite forms deposits on the walls of the apparatus, which must be cleaned of dense sediment. The precipitate could be dissolved in hydrochloric acid, but this would produce harmful sulfur dioxide. Now, if only we could oxidize sulfite to calcium sulfate! Typically, such oxidation is carried out with air at a very high temperature, which greatly complicates the process (in this case, waste processing). How to simplify the process of converting potassium sulfite into sulfate in wet ash collectors? Source: Sat. CRISIS - CNTI, 1992, p. 108.",https://www.trizland.ru/tasks/5184/
Problem 422. “Who is more?”,The leader of the tribe can only count up to 10. The tribe is very large - more than 100 people. How to determine who is more numerous in a tribe: men or women?,https://www.trizland.ru/tasks/5185/
Problem 423. “Water in a jug”,Water is poured into a jug with a narrow neck. The jackdaw bird cannot reach the water. How can she drink water from a jug?,https://www.trizland.ru/tasks/5186/
Problem 424. “Transfer cash”,"A company or citizen sells an apartment or other real estate for cash. Money needs to be transferred from hand to hand. What if the buyer is a fraudster, what if he takes the money, hands him a “doll” or counterfeit money. How to organize a transaction most securely? Why not hire security?",https://www.trizland.ru/tasks/1347/
Problem 425. “Malicious” motorist”,"Breaking a rule is good or bad. Surely good. It’s good when an inventor violates and destroys stable stereotypes and successfully solves a problem. However, breaking traffic rules is bad. This may lead to an accident. What about persistent violators? It is advisable to identify drivers who have repeatedly violated traffic rules, so that other car owners can immediately understand on the road that a source of increased danger is driving. How to do it?",https://www.trizland.ru/tasks/1660/
Problem 426. “The greedy director rolled his lip…”,"Before building a new one, it is often necessary to destroy the old. One company needed to demolish eight old buildings stuck to each other and clear the site for construction. But the money-hungry director demands to do it for free! Imagine: you are a manager. How will you perform it?",https://www.trizland.ru/tasks/1348/
Problem 430. “Court is not a toy”,"In countries where it is fashionable to sue for any reason, the courts are simply overwhelmed with scandalous lawsuits. Many of them are not even substantiated. But judges are not fools either: they want to work less and do really important things. How to rid the courts of “empty” trials? Suggest several ways.",https://www.trizland.ru/tasks/1352/
Problem 431. Golden Ostrich Eggs ,"On poultry farms in Africa, and now in Russia, ostriches are bred in large quantities. Come up with as many ways as possible to “make money” on ostriches.",https://www.trizland.ru/tasks/1353/
Problem 433. Delivery of the tank ,We need to transport a huge tank from one city to another. The length of the tank does not allow you to turn around on street corners. What should I do?,https://www.trizland.ru/tasks/5187/
Problem 434. “Open your face…”,"Most Indians do not have passports. Hence the fraud at the ballot box. India's Chief Election Commissioner decided to introduce photo ID cards throughout the country. However, the Muslim clergy opposed this initiative. According to Sharia law, it is unacceptable for a woman in a burqa to reveal her face to an unknown man, be it a photographer, a police officer or an official issuing ballots. How to prevent fraud at the ballot box without violating Sharia law?",https://www.trizland.ru/tasks/1354/
Problem 435. Glass balls ,"There are two identical glass balls and one 100-story building. It is known that balls begin to break when they hit the ground, falling from a certain floor. How to determine the minimum number of drops of these balls from different floors, for which you can be guaranteed to find this very floor? Source: Creative association “Flight of Thought” (Chelyabinsk)",https://www.trizland.ru/tasks/5188/
Problem 436. Everyone go to bed: There will be no cinema!,Among the television viewers of one New York television company there were many people suffering from insomnia. The unfortunate ones cannot sleep even after the broadcast ends. What can a TV company do to help TV viewers fall asleep immediately after the end of the program?,https://www.trizland.ru/tasks/1355/
"Problem 437. I'm running, running, running, but the traffic light is not shining...","A man decided to take care of his health - he began to run in the evenings, but it turned out that these evening runs are dangerous, you can end up under a car. How to avoid accidents, since jogging has already become a habit?",https://www.trizland.ru/tasks/1356/
Problem 438. “Inject yourself!”,"Even with the creation of disposable syringes, the problem of infection with infectious diseases has not been solved: to save money, disposable syringes are reused after being processed in a sterilizer. How to force doctors to use a syringe only once?",https://www.trizland.ru/tasks/1357/
Problem 439. Top Secret ,"The messages that we receive via telefax usually remain on a roll of paper that crawls out of the machine, and anyone can read them. How to ensure that received messages can only be read by the person to whom they are addressed?",https://www.trizland.ru/tasks/1358/
Problem 440. “Fuel tank”,"The best aircraft of the Great Patriotic War, the Il-2, was developed under the leadership of S.V. Ilyushin. When creating the aircraft, many inventive problems were solved. Here is one of them. A bullet hitting a gas tank filled with fuel is not very dangerous. But if the tank is not full, the empty space is filled with gasoline vapors, which easily explode. How to ensure fire safety when the tank is not full? Source: Creative association “Flight of Thought” (Chelyabinsk)",https://www.trizland.ru/tasks/5189/
Problem 441. “Ozone corrosion of power electrical cables”,"Strong electromagnetic fields create ozone in the air around power cables and other electrical devices. Ozone acts (oxidizes) and destroys polymer dielectric shells. How to deal with ozone corrosion? Source: Sat. CRISIS - CNTI, 1992, p. 109",https://www.trizland.ru/tasks/5190/
Problem 445. “Invention of Viktor Alekseev”,"Soviet coach Viktor Ilyich Alekseev trained a galaxy of Olympic champions. To a large extent, the students' successes were based on the ingenuity of the coach. Working with world record holder Vladimir Trusenev, the coach proposed a new version of the discus throwing technique. The training was difficult - it is difficult to break the skills developed over the years, which, moreover, made it possible to set a world record. Alekseev was known as a master of demonstration: when he came up with new elements of technique, he demonstrated them to his students during training, achieving repetition. But the coach did not have enough energy and time when working with Trusenev. And in this case, Viktor Ilyich’s ingenuity helped. What did the coach do?",https://www.trizland.ru/tasks/1751/
Problem 447. “Rescued relics”,"Leningrad. Blockade. In a hurry, artistic treasures are being evacuated from the palaces of Pushkin, Lomonosov, Gatchina, Pavlovsk and Petrodvorets. But here’s the problem: where to hide priceless paintings, furniture, porcelain from bombing in a besieged city, which the Nazis are constantly bombing and shelling?",https://www.trizland.ru/tasks/1363/
Problem 448. “New maternity hospital services”,The decline in the Japanese birth rate has led to a drop in the income of obstetricians. And in the maternity hospital in the city of Ibakiri they began to offer new forms of service for a lot of money. Do you have any ideas? Offer new types of services.,https://www.trizland.ru/tasks/1364/
Problem 450. “Don’t turn over!”,A problem arose at the spare parts warehouse of the French automobile company Renault: about 3% of windshields reached auto repair stations broken. Even despite the fairly reliable packaging - cardboard boxes with porous polyurethane gaskets. How to reduce glass breakage?,https://www.trizland.ru/tasks/1366/
Problem 451. “To hew or not to hew?”,"Pavement stones - what could be simpler? However, even this unsightly object can become the subject of a heated dispute. When the municipality of the Dominican city of San Francisco de Macoris decided to pave the main street, the entire population was divided into two warring camps. The first argued that pavement stones should be hewn: it was more convenient and more modern. The second - traditionalists - argue that they should not be crowded: this, they say, will disrupt the historically established appearance of the city center. What should the city fathers do? You need to pave the street, but just as much you want peace and the absence of conflicts.",https://www.trizland.ru/tasks/1654/
Problem 452. “Bottles with medicine”,"Bottles of medicine were delivered to the pharmacy, each containing a thousand pills. It became known that, due to a pharmacist’s mistake, in one of the bottles each pill contained 10 mg of medication more than the permissible dose. How to identify a bottle with an increased dose of medication by just one weighing? Source: Creative association “Flight of Thought” (Chelyabinsk)",https://www.trizland.ru/tasks/5191/
Problem 455. Women's reformer ,"Pahlavi, the Shah of Iran, wanted to give a modern look to his country and... reveal the faces of Iranian women. According to Islamic law, removing a burqa from a Muslim woman means dishonoring her. And here it’s not far from suicide. How to convince Iranian women to reveal their faces?",https://www.trizland.ru/tasks/1369/
Problem 456. Cardinal - Tamer of Women ,"During the time of Cardinal Richelieu, it became fashionable among French aristocrats to drive a horse team themselves, without a coachman. Cases of collisions and collisions with passers-by have become more frequent. It is impossible to force a woman to give up her desire; this was well known already in the time of Richelieu. How can a cardinal “put” crazy aristocrats in their place?",https://www.trizland.ru/tasks/1370/
