title_english,content_english,link
Problem 1191. “To the menagerie - without money”,"From the 13th century until 1830, the Royal Tower Castle in London housed a menagerie of lions, leopards and other exotic animals for the entertainment of crowned heads. In the 16th century it was opened for a small fee to ordinary visitors. The money went mostly to food for the animals. In the 18th century, the keepers of the royal menagerie decided that any visitor could bring food for the lions. Therefore, the payment system for entering the menagerie was modified. How could visitors look at exotic predators without paying money?",https://www.trizland.ru/tasks/5642/
Problem 1192. “Non-author cinema”,"Film production in Hollywood has long been transformed into a conveyor belt, where almost any author's approach is transformed in one way or another under the influence of many factors. Scandals are not uncommon during filming. There are cases when filmmakers refuse to have their names mentioned in the credits on principle. In 1969, the Cinematographers Guild of America faced an unprecedented fact. During the filming of the western Death in a Gunfight",https://www.trizland.ru/tasks/5643/
Problem 1193. “Popular reading”,"In 2000, French writer Frédéric Beigbeder released a new novel called “99 Francs.” Based on the title, publishers negotiated with bookstores so that the novel would be sold at exactly that price. Subsequently, the novel was translated into German, English, Japanese and other languages. The publishers really wanted to “transfer” the found marketing ploy outside of France. But how to do that? After all, other countries have different currencies...",https://www.trizland.ru/tasks/5644/
Problem 1194. “You can’t leave deleting”,"A commercial company has a computer network with many hundreds of users. In the course of their work, users create various files and save them in separate folders on a central server. Everything would be fine, but the number of files is growing (new ones appear in addition to old ones), which makes it necessary to purchase additional hard drives for the central server. This entails significant costs. An attempt to assign responsibility for files from users failed, because. they must solve business problems. In the same way, the idea of ​​forcibly deleting files by technical specialists failed because it could stop users from working due to the lack of necessary information. How to stop uncontrolled file growth without putting the company's business at risk? A real practical business problem. It seems simple at first glance, but there is no obvious solution. Submit your options!!!",https://www.trizland.ru/tasks/5645/
Problem 1195. “One piece at a time from a coin – income for a fraudster”,"Until the end of the 17th century in England, all cash financial transactions were carried out with silver coins, the value of which was determined by the amount of silver they contained. Therefore, during large trade operations, coins were sometimes simply weighed. But for “small” payments with one or two coins, it was still more convenient to use the denomination of the coins. The scammers quickly realized that if they quietly “pinch off” a piece of silver from a coin, its denomination will not change, and a couple of new coins can be cast from such pieces. To stop this “lawlessness,” in 1696 the English government decided to confiscate all “old” silver coins from the population and exchange them at face value for “new” ones. But how can newly printed coins be protected from flaws and counterfeits? Until the end of the 17th century in England, all cash financial transactions were carried out with silver coins, the value of which was determined by the amount of silver they contained. Therefore, during large trade operations, coins were sometimes simply weighed. But for “small” payments with one or two coins, it was still more convenient to use the denomination of the coins. The scammers quickly realized that if they discreetly “pinch off” a piece of silver from a coin, its denomination will not change, and a couple of new coins can be cast from such pieces. To stop this “lawlessness,” in 1696 the English government decided to confiscate all “old” silver coins from the population and exchange them at face value for “new” ones. But how can newly printed coins be protected from flaws and counterfeits?",https://www.trizland.ru/tasks/5646/
Problem 1196. “You can’t see the football behind the fog”,"At the beginning of the Second World War, German planes began to actively carry out massive raids on England, but the country tried to live a normal life. Thus, in Edinburgh, the capital of Scotland, in 1940 a traditional football championship was held among the teams of the region. All matches were broadcast live on radio. During one of the matches, there was such a dense fog over the football field that the radio commentator from his position could not see the players at all. But the military prohibited canceling the broadcast of the match: then the Germans, who certainly listened to all English radio programs, could guess the weather conditions and send their bombers to Edinburgh. How did the commentator get out of this sticky situation? At the beginning of the Second World War, German planes began to actively carry out massive raids on England, but the country tried to live a normal life. Thus, in Edinburgh, the capital of Scotland, in 1940 a traditional football championship was held among the teams of the region. All matches were broadcast live on radio. During one of the matches, there was such a dense fog over the football field that the radio commentator from his position could not see the players at all. But the military prohibited canceling the broadcast of the match: then the Germans, who certainly listened to all English radio programs, could guess the weather conditions and send their bombers to Edinburgh. How did the commentator get out of the sticky situation?",https://www.trizland.ru/tasks/5647/
Problem 1197. P at the beginning of the alphabet,"In 1990, a new player appeared in the Chinese market of computer equipment manufacturers, which subsequently entered the international level. Following the ancient rule “whatever you name a ship, so it will sail,” they then decided to name the company after the mythological swift-winged horse – “Pegasus.” When registering a company, marketers drew the attention of the owners to the fact that in all directories, companies are most often located in alphabetical order. Therefore, a new company with ambitious plans and a name starting with the letter “P” will be located somewhere in the second half of any general list. The management did not want to abandon the original name. How did you solve the problem?",https://www.trizland.ru/tasks/5648/
Problem 1198. “Stylish shoes without heels”,"In 2008, at one of the social parties in England, the famous football player David Beckham appeared with his wife Victoria, who shocked the audience with her shoes. Victoria had stylish boots on her feet, which in shape suggested high heels, but these heels were completely absent. It seemed that the socialite was moving like a ballerina. However, Victoria felt quite stable in such boots. How did designer Antonio Berardi manage to make such shoes?",https://www.trizland.ru/tasks/5649/
Problem 1199. “Roosevelt’s razors weren’t interested”,"At the beginning of his career, King Camp Gillette was a traveling salesman for various companies. He always took great care to make a favorable impression on potential buyers and wore a luxurious mustache, which he carefully maintained. It was during the process of shaving that he came up with the idea to create a safety razor. In 1910, when Gillette established a large-scale production of safety razors, he offered former US President Theodore Roosevelt for a large sum to head the corporation's branch in Arizona. Roosevelt refused. How did the former president justify his refusal?",https://www.trizland.ru/tasks/5650/
Problem 1200. Cubic magic ,"A smaller glass cube was placed in an empty glass cube; it is visible. Then they filled all the cubes with the same liquid, and the small cube disappeared. Why?",https://www.trizland.ru/tasks/5651/
Problem 1201. Live exposure meter,"At the dawn of photography, when there were no automatic exposure meters, photographers were forced to set the shutter speed and aperture on their cameras “by eye.” Photographic materials were not cheap back then, and the wrong choice of light led to defects. In the mid-18th century, the English photographer Oscar Reilander, who shot many productions in the pavilion, came up with the idea of ​​​​using animals as an exposure meter. How did he do this?",https://www.trizland.ru/tasks/5652/
Problem 1202. “Field kitchen of the Huns”,"In the 70s of the IV century. AD The eastern nomadic tribes of the Huns, led by Atilla, conquered the lands of Western Europe. The Huns' warriors spent most of their time in the saddle, making long, multi-day marches. At the same time, they learned to salt cold meat for themselves to eat while moving. How did they do this?",https://www.trizland.ru/tasks/5653/
Problem 1203. Gamblers at War ,"During World War II, in some places Americans who were prisoners in German camps were allowed to play cards from time to time. After this became known to intelligence, the US government ordered a manufacturing company to make special sets of playing cards, which were given to prisoners of war in Europe as humanitarian aid. Moreover, these cards could be used not only to pass the time by playing, but also in the event of an escape from captivity. How were playing cards supposed to help prisoners of war?",https://www.trizland.ru/tasks/5654/
Problem 1204. Caesar in Africa ​​,"When Julius Caesar's troops first arrived to conquer the African continent, the general himself tripped and fell face down as he disembarked from his ship. This was a bad sign for the superstitious soldiers. Caesar could not allow the morale of his troops to fall because of some symbolic omen. What did Caesar do to dispel the unrest among his soldiers?",https://www.trizland.ru/tasks/5655/
Problem 1205. E-novel,"In French, the letter “e” is most often used. As an experiment, the writer Georges Perec wrote a novel called “La disparition”, in which the letter “e” was not used even once. Published in 1969, the novel turned out to be quite successful and was translated into English, German, Italian and other languages. How did the translators manage to preserve the experimental nature of the novel?",https://www.trizland.ru/tasks/5656/
Problem 1207. “When a bug doesn’t get into your throat”,"In frogs, teeth are located only on the upper jaw and serve only to hold prey caught with the tongue. The tongue can throw out to hunt insects",https://www.trizland.ru/tasks/5658/
Problem 1208. Quick Cleaning,"Construction of the Winter Palace in St. Petersburg began in 1754 and lasted eight years. Almost four thousand workers were involved. While working, they lived in temporary huts and sheds, which were installed right on the square in front of the Winter Palace. In the spring of 1762, the palace was built and was ready to receive Emperor Peter III. All that remained was to quickly clear the area of ​​rubbish and debris, which had accumulated in great abundance over the years of construction. To save both time and human resources, the then head of St. Petersburg, Chief of Police General Nikolai Andreevich Korf, made a decision, after which the square was cleared in just a couple of days. How did Corfu do it?",https://www.trizland.ru/tasks/5659/
Problem 1209. “Time for some steam”,"In 1774, Scottish mechanic James Watt built a universal steam engine. Its efficiency was much greater than other traditional sources of mechanical energy at that time. Educated people understood this well. But there were relatively few of them. How did Watt manage to clearly demonstrate the efficiency of his invention?",https://www.trizland.ru/tasks/5660/
Problem 1210. “Fishing with Velcro”,"Sticky fish, which are found in tropical and subtropical oceanic waters, most often lead a parasitic lifestyle. The anterior dorsal fin of the clam is located closer to the head and is a powerful sucker. Therefore, fish ranging in size from 30 to 90 cm can attach themselves to larger sea creatures - sharks, turtles, and whales. In ancient times, the indigenous people of Mozambique and Madagascar learned to use this natural instinct to stick to fish. How did they do this?",https://www.trizland.ru/tasks/5661/
Problem 1211. Fly Qantas planes! ,"In 1988, the Hollywood film “Rain Man” was released. It received four Oscars and many other prestigious awards, and was liked by the audience, so many airlines, at the request of passengers, decided to show it during long flights. At the same time, only one scene in the film confused the airline owners. In it, the main character does not want to fly on any other airline except the Australian Qantas, explaining this by the fact that in the entire history of the existence of this air carrier, their passenger planes have never crashed. And although this fact is confirmed by statistics, airlines, naturally, could not afford such anti-advertising on board a flying aircraft. How did you solve the problem?",https://www.trizland.ru/tasks/5662/
Problem 1212. “What was Remarque’s name?”,"By 1933, when the Nazis came to power in Germany, the German writer Erich Maria Remarque had already won a name for himself in world literature and was even nominated for the Nobel Prize. The Nazis banned and burned Remarque's books because of their anti-war content. The writer himself was forced to emigrate. To discredit him in the eyes of public opinion, fascist propaganda created a myth about the writer’s Jewish origin. It was reported that he even changed his Jewish surname. What, according to Nazi propagandists, was Remarque's real name?",https://www.trizland.ru/tasks/5663/
Problem 1213. Tarantino the Smoker ,"In the films of American director Quentin Tarantino, there are often characters who smoke. The display of cigarettes of a certain brand is, one way or another, associated with hidden advertising. Tarantino did not want to get involved with the tobacco lobby. What solution did the director find for his smoking movie characters?",https://www.trizland.ru/tasks/5664/
Problem 1214. “The Birth of a Star”,"In 1995, Ukrainian singer Carolina Kuek, who performed under her own name, took part in the Russian television competition “Morning Star”. It turned out that there was already one singer named Carolina on the list of participants in the competition. There could be confusion among viewers and the jury. It was urgent to look for a pseudonym. At the same time, the singer did not refuse to give up her name. How did Caroline Kuek solve this problem?",https://www.trizland.ru/tasks/5665/
Problem 1215. “Internet in Eskimo style”,"The Internet in the 21st century has reached the inhabitants of the Far North. The Eskimos naturally had the question of naming a new phenomenon in their life. It was, of course, possible to introduce a familiar international designation into the Eskimo language. However, the experts decided to choose a word that, on the one hand, would denote the essence of the phenomenon itself - that is, unified computer networks for storing information, and on the other hand, was already in the habitual linguistic use of the Eskimos. What semantic meaning of the word did experts choose to denote the Internet in the Eskimo language? The Internet in the 21st century reached the inhabitants of the Far North. The Eskimos naturally had the question of naming a new phenomenon in their life. It was, of course, possible to introduce a familiar international designation into the Eskimo language. However, the experts decided to choose a word that, on the one hand, would denote the essence of the phenomenon itself - that is, unified computer networks for storing information, and on the other hand, was already in the habitual linguistic use of the Eskimos. What semantic meaning of the word did the experts choose to denote the Internet in the Eskimo language?",https://www.trizland.ru/tasks/5666/
Problem 1216. “Astronauts are not covered by insurance”,"In 1961, the American Space Exploration Agency (NASA) began the Apollo program to launch manned spacecraft to the Moon. The first astronauts were trained. However, before the flight a problem arose. Because the risk that the astronauts would not return to Earth was too great, not a single American insurance company would undertake to insure their lives. NASA, in the event of the possible death of the pilots, needed to compensate subsequent expenses to their families. How did NASA specialists overcome the situation?",https://www.trizland.ru/tasks/5667/
Problem 1217. “Life-size sculpture of the Earth”,"Italian avant-garde artist Piero Manzoni often shocked audiences with his unusual conceptual designs in the 1950s and 60s. One day he came up with the idea of ​​creating a sculpture the size of planet Earth. Despite the seeming absurdity of the idea, Manzoni implemented it. How did the artist manage to do this?",https://www.trizland.ru/tasks/5668/
Problem 1219. “Take care of your ear from a young age”,"According to research by scientists, at an early age the human ear is usually able to perceive a significant part of high-frequency sounds well. With age, this ability deteriorates. This phenomenon is sometimes used by police in some European countries to restore order. How do they do it?",https://www.trizland.ru/tasks/5670/
"Problem 1220. “Well, very healthy hamburgers”","In 1921, the American company White Castle began producing the most popular type of fast food - hamburgers. In advertising a new type of food, the company emphasized the stable price of the new product and the transparency of its production: hamburgers were cooked right in front of customers. And using a little trick, the company's owners managed to convince people of the “sterility” and nutritional benefits of hamburgers. How did they do this?",https://www.trizland.ru/tasks/5671/
Problem 1221. “Letters to the Motherland”,"Volgograd artist Vladislav Koval entered the Moscow Printing Institute in 1971. Life for students away from their home, although fun, is, as a rule, not rich and teaches economy. Vladislav figured out how to save money on letters, which he quite often sent not only to Volgograd, but also to other cities of the Soviet Union. How did he do it?",https://www.trizland.ru/tasks/5672/
Problem 1222. “The Secret of the Vampire”,"Most cephalopods, such as octopuses and cuttlefish, have adapted to defend themselves from their enemies by releasing a cloud of black liquid from a special sac in their body. While the “ink” dissolves in the water and the predator begins to see something, the mollusks have time to escape. But a mollusk called the vampire hell squid lives at a kilometer depth, where sunlight no longer penetrates. The water there itself is black. How does a mollusk protect itself from its enemies?",https://www.trizland.ru/tasks/5673/
Problem 1223. “Gun for astronauts”,"The Cold War between the USSR and the USA coincided with active space exploration. And Soviet designers, “just in case,” in the first half of the 1980s, developed personal defense weapons for cosmonauts. Conditions in space, of course, differ from those on earth. What kind of pistol could be for astronauts?",https://www.trizland.ru/tasks/5674/
Problem 1224. Pipeline test ,"On the conveyor belts of microchip manufacturing plants, good dexterity and coordination of movements are required. Therefore, in China, Japan, and other Asian countries, in addition to the usual interview, many applicants undergo a manual dexterity test when applying for a job. How do employers determine whether a potential employee will be able to handle his or her job? On the conveyor belts of microchip manufacturing plants",https://www.trizland.ru/tasks/5675/
Problem 1225. “Ascension Island is in the ocean”,"In 1815, after the defeat at Waterloo, Napoleon I Bonaparte voluntarily surrendered to the British, who sent him into exile on the island of St. Helena in the middle of the Atlantic Ocean. Next to this island there was another one - a small uninhabited Ascension Island of volcanic origin. Here the British stationed a small garrison of soldiers to guard Napoleon. But, as it turned out, the state treasury did not provide for the maintenance of this land garrison - all the money was spent on maintaining the fleet. And yet, the commanders of Napoleon’s English guard found a way to get funding. How did they do this?",https://www.trizland.ru/tasks/5676/
Problem 1226. “Colorful toothpaste”,"In the early 1960s, toothpaste manufacturers offered consumers a new product that is still in good demand today. This is a “multi-colored” toothpaste - it falls on the brush in the form of stripes of two or three colors. At the same time, the strips remain even and do not mix with each other. How was this achieved?",https://www.trizland.ru/tasks/5677/
Problem 1227. “2+2=how much do you need”,"As is well known, on the one hand, statistics knows everything",https://www.trizland.ru/tasks/5678/
Problem 1228. At the Kabalev Concert,"In the 1970s, Spanish opera singer Montserrat Caballe sometimes had to deal with a rather awkward situation during her recitals. Sometimes fans deliberately sat in the front rows with a tape recorder in their hands to record the singer’s performance. Tape recorders back then were cassette recorders, and when one side of the tape was recorded, you had to turn the tape over. This bothered the singer. How did Monserat Caballe react to this behavior from fans during the concert?",https://www.trizland.ru/tasks/5679/
Problem 1229. “Skiing on gravel”,"In the 1960s, Soviet designers worked on the implementation of the Spiral aerospace project. It involved the creation of a special aircraft that was launched into orbit with the help of another aircraft and a rocket stage. First, an exact copy of the future orbital aircraft was built. Instead of wheels, it had disc skis. But during the first tests it turned out that the power of the aircraft’s engines was not enough to accelerate on disc skis on a gravel runway. However, the testers then managed to get the plane into the air. How?",https://www.trizland.ru/tasks/5680/
Problem 1230. “Profitable provocation”,"American avant-garde artist Man Ray created an original exhibition object in 1923. It was an ordinary metronome, on the pendulum of which was attached a part of a photograph of a woman's eye. The provocative name of the object contained a call. In 1953 in Paris, visitors to the exhibition where this object was exhibited took this call literally. As a result, Man Ray received a tidy sum from the exhibition organizers. What was the name of the object?",https://www.trizland.ru/tasks/5714/
Problem 1231. “The fish illuminates the wigwam”,"A fish of the smelt family called eulachon (Thaleichthys pacificus) is found along the North American Pacific coast. Its body is up to 30 cm long and consists of fifteen percent fat. In ancient times, the Indians of North America learned to use this resource to illuminate their wigwams. How did they do this?",https://www.trizland.ru/tasks/5682/
Problem 1232. Death to flies!,"Many insects carry pathogens that are deadly to humans and animals. Females of some species of insects, such as the Tsetse fly, mate only once in their lives. Using this natural resource, the Zanzibar Islands in the Indian Ocean were rid of the Tsetse fly in the mid-1990s. How did they do it?",https://www.trizland.ru/tasks/5683/
Problem 1233. Cleanliness of the Middle Ages,"Residents of Europe in the Middle Ages were not known for their cleanliness. This was often one of the main reasons for the spread of epidemics and diseases. For example, fleas can carry viruses for 25 diseases. How did you fight fleas at a time when personal hygiene was “out of fashion”?",https://www.trizland.ru/tasks/5690/
Problem 1234. “Koalas cross the road”,"Koalas, Australia's quirky little bears, spend most of their lives hibernating among the branches of eucalyptus trees, the leaves of which are the animals' main source of food. When there are no leaves suitable for food on a tree, koalas move to another tree - they jump over or run across the ground. Where highways pass through eucalyptus forests, koalas sometimes die under the wheels of passing cars. How to protect animals from such death?",https://www.trizland.ru/tasks/5685/
Problem 1235. “The Prophet on the Screen”,"In 1977, a film called “The Message” about the life of the Prophet Muhammad was released in Libya. The then leader of Libya, Muaammar Gaddafi, commissioned a film from an American director of Syrian origin, Mustafa Akkad, to promote the ideas of Islam. The director was faced with a problem. It was necessary to show the life of a man who became a Muslim prophet, but the Muslim religion prohibits the depiction of the Prophet Muhammad. How did the director manage to solve the problem?",https://www.trizland.ru/tasks/5686/
