title_english,content_english,link
Problem 1. “Where do the exhibits disappear?”,"In the historical and local history museum of the Ural city of Katav-Ivanovsk, exhibits disappear without a trace: they are simply devoured by hungry rats. At first they took a liking to stuffed birds and small animals, and now they have started on the bear. What should museum employees do?",https://www.trizland.ru/tasks/1241/
Problem 2. “Is Old Man Hottabych to blame?”,"Anyone who has read one fairy tale remembers that Old Man Hottabych “rooted” for his favorite football team. But he received a scolding from his venerable master Volka ibn Alyosha for the devastating expense. Hottabych then had to instantly infect all members of the losing team with measles. As a result, the result of the match was canceled. So what? History repeats itself. In September 1998, an American football match took place between the teams: Duke University and the Blue Devils (Florida). And the result? On the same day, all the players came down with a severe viral disorder stomach. It’s interesting that Old Man Hottabych was not present at this match... I would like to find out the reason for such an unexpected incident. Your versions?",https://www.trizland.ru/tasks/1777/
Problem 4. “Reflective network”,"As studies have shown, the threads of the web best reflect ultraviolet rays, and ultraviolet is a signal of clear skies, and gullible insects rush there. However, if the web is illuminated, it will simply be visible, and not a single self-respecting fly will head to certain death. How did they solve this problem and how do they lure the victim into their networks?",https://www.trizland.ru/tasks/1626/
Problem 5. Network on the horizon,"Forest. Spider networks. Some of them are located horizontally. But it is not clear why this was done. After all, insects no longer fly up and down, but horizontally. By the way, it is interesting that the owner himself walks upside down on such a network. So: Why is the network located horizontally? Why does the spider walk upside down on such a network? Suggest hypotheses.",https://www.trizland.ru/tasks/1627/
Problem 6. “Repairing networks”,"Spiders weave webs at night or early in the morning. Moreover, these networks do not last long. Why? It’s just that in dry air the sticky substance changes its consistency and the strength of the network decreases. Beetles, bumblebees and other large insects tear apart the web. Therefore, after one or two nights the spider has to renew the network. Such weak networks need to be constantly repaired, and this leads to a large consumption of building material. So you won’t get enough material. How did spiders solve this problem?",https://www.trizland.ru/tasks/1628/
Problem 7. Signal network,"Oh, World of Smells! Oh, World of light and color! Oh, the World of sounds!.. The worlds in which we live. What about the World of touch? In this world, a person does not feel very confident - there are no developed organs. Spiders live in the World of Touch. At the tips of their legs, spiders have extremely sensitive organs of touch. The arachnoid network is, as it were, a tactile organ of an insect carried far from the body, transmitting information. However, there are always many influences on the web - the influence of wind and rain, the influence of large animals and insects. I wonder how a spider obtains the necessary information from a large number of influences on the web? Why doesn't he rush at every movement of the net?",https://www.trizland.ru/tasks/1629/
Problem 8. “Spiders in a flock”,"Swarms of spiders. Do they exist in nature? If so, why do spiders flock together? Surely, just like, for example, wolves, they flock together in order to hunt for large prey. It is known that such spiders exist in nature, and they jointly hunt for insects that they cannot cope with alone. However, in order to hunt in concert, they need a communication system. This is good for wolves - they have well-developed vision and hearing. And spiders have only one wealth - the web. Spiders living in groups use special web threads to disseminate information to all their relatives. In this case, the signal threads are quite long and therefore need to be secured somewhere. But a thread attached to a support cannot transmit vibrations. What about spiders?",https://www.trizland.ru/tasks/1631/
Problem 9. “A fly for lunch”,"Big fly for lunch. It is so beautiful! For a spider. However, spiders are small insects. Spiders differ from other arthropods in that their body is divided into two parts. The head is fused with the chest and, with the help of a thin part, is connected to the tummy. This part of the spider's body contains the lungs, liver, heart, ovaries and digestive tract. But the latter is very small, and the fly is big. I wonder how the spider eats a fly that would not fit inside the spider?",https://www.trizland.ru/tasks/1632/
Problem 11. Spider Bell Underwater ,"Spiders living underwater need to transport a large bubble of air from the surface of the water to the depths. This is easy to say but difficult to do, since air is much lighter than water and tends to rise. In addition, it is necessary to quickly and accurately find its home. What should a spider do?",https://www.trizland.ru/tasks/1634/
Problem 13. Spiders vs. Bees ,"Some spiders cause trouble for humans. The labyrinth spider living in the meadows weaves its webs so diligently that it sometimes destroys many bees. Beekeepers value bees, but spiders are also useful and should not be poisoned. What do you recommend beekeepers do?",https://www.trizland.ru/tasks/1243/
Problem 15. Checking drugs,"Every day new drugs are synthesized around the world. All of them must be checked. Most often, the effects of drugs are tested on different animals. But this is long and expensive, large doses of the substance are needed. What to do if you need to test new drugs, but very few of them have been synthesized. How to check if they work at all?",https://www.trizland.ru/tasks/1245/
Problem 17. “Bird air conditioners”,"When it is hot, a person turns on the air conditioner or takes off some of his clothes... Birds do not have air conditioners. How do birds save themselves from the heat? Suggest possible ways (inventions) by which birds fight the heat.",https://www.trizland.ru/tasks/1246/
Problem 18. “Benefits from locusts?”,It happens that fields are attacked by locusts. The consequences are terrible! But what positive can come from locust raids?,https://www.trizland.ru/tasks/1247/
Problem 19. “Lazy predator”,"How can a predator not chase prey, but catch the prey? Suggest methods and specific biological solutions for lazy predators.",https://www.trizland.ru/tasks/1248/
Problem 20. “Do bees have intelligence?”,"Usually the behavior of animals is usually explained by innate instincts. But how, for example, can we explain behavior in an unusual environment in this way? Propose a series of experiments showing that living beings, such as bees, have intelligence that allows them to find a way out of unusual situations.",https://www.trizland.ru/tasks/1249/
Problem 21. “The bird defeats the snake”,"For snakes, bird eggs are a favorite treat. Birds need to preserve their offspring... So, a snake approaches the swallow’s nest to feast on the eggs. What should a swallow do?",https://www.trizland.ru/tasks/1250/
Problem 23. “Combating poaching”,"Many forests are inhabited by poachers who illegally shoot animals, causing significant damage to nature reserves. Moreover, the main problem is that it is difficult to catch a poacher at the crime scene. What to do? Suggest several ways to combat poachers.",https://www.trizland.ru/tasks/1651/
Problem 24. “Take honey from the “giants”,"A bee sting is an unpleasant event. What about a giant bee sting? So, giant bees live in Indonesia. These insects are extremely dangerous - their bite is fatal, but they bring a lot of honey. The bees' nests - up to one and a half meters in size - are suspended from tree branches. Local residents, despite the danger, manage to collect honey without casualties. How? Offer your solutions.",https://www.trizland.ru/tasks/1703/
Problem 25. “False eggs”,"Cuckoos shamelessly parasitize other birds, laying one egg at a time in their nests. At the same time, many birds do not notice someone else's egg. How do cuckoos manage to camouflage their eggs like this?",https://www.trizland.ru/tasks/1252/
Problem 26. “Recognition at the cost of life”,"Aleksandar Hemon's novel The Lazarus Project describes the situation of a photojournalist named Rora at a checkpoint in Sarajevo during the war between Orthodox Serbs and Muslims. “In one of the Chetniks, Rora recognized his pre-war poker partner... Rora recognized him by his eyes - he more than once looked intently into these eyes at a card table littered with the currencies of different countries. The name of the former gambler was Zloyutro; and he immediately recognized Rora. I checked his pass, looked at his face and sternly shook his head: they say, do you think I’m a fool, or what? And he asked: “Who are you, anyway?” Rora could have lied and called himself a Serb, but the Chetnik knew that this was not true; if Rora had admitted that he was a Muslim, he could have been accused of espionage - in either case, he would have been in trouble. And Rora said: “What did the photojournalist answer to get out of the sticky situation?",https://www.trizland.ru/tasks/5038/
Problem 27. Black Hand ,"The famous Italian actor Salvinia once, while playing the role of Othello, forgot to paint his hands black. He noticed his mistake already while on stage. The audience noticed too. How can an actor get out?",https://www.trizland.ru/tasks/1774/
Problem 28. Niels Bohr Medal,"In 1943, the greatest physicist of the 20th century, Nobel Prize winner in 1922, Niels Bohr, hiding under an assumed name, was forced to flee Nazi-occupied Denmark. The fishermen secretly transported him by boat to Sweden. You were not allowed to take any valuables with you. And even more so, a gold medal from a Nobel laureate, which, in the event of an unsuccessful operation, could immediately betray the scientist. Simply hiding the medal somewhere in Copenhagen or handing it over to someone for safekeeping was dangerous, unreliable and there was no time - there was a war going on... And yet, returning a few years later from the USA to Denmark after the war, Bohr received his medal in its original form. How did he do it?",https://www.trizland.ru/tasks/5041/
Problem 29. “How to get a tip?”,"After the reunification of Germany (Western and Eastern), restaurant owners in Florida (USA) began to have difficulties with German tourists. Interesting: Germany united, but problems arose in an American restaurant. Why suddenly? It's simple: East Germans began to travel and “drop in” to this very Florida restaurant. They just didn’t know how much it was customary to tip. And they inadvertently underpaid tips - unlike the West Germans, who knew the accepted rules and did it regularly. And who wants to miss out on their income? So the waiters began to think - what to do? West Germans, of course, give the required amount of tips themselves, and East Germans... can be included in the bill. You just need to “sort” West Germans from East Germans, and not offend any of them. How to do it?",https://www.trizland.ru/tasks/1775/
Problem 30. “Why did you climb a tree?”,"When going hunting, a mother bear leaves her cubs alone. But what’s interesting is that when she returns, the cubs behave very strangely. As soon as they see their mother, they climb thin trees. For what?",https://www.trizland.ru/tasks/1776/
Problem 32. “Railway against homeowners”,"In 1938, twenty homeowners in Baltimore, USA, sued the Pennsylvania Railroad, claiming that vibrations caused by passing trains were damaging the walls, ceilings and plaster of their homes. The houses stood along the street along which the railroad track ran. Several trains passed through it every day. Heavy trucks also drove along the street, but the process was organized only against the railway. And although representatives of the railway company were sure that the accusations were incorrect, they had no opportunity to refute them in court. Moreover, the jury members were not seismography specialists, but ordinary citizens. How can you clearly prove that vibration from passing trains does not destroy nearby houses?",https://www.trizland.ru/tasks/5048/
Problem 33. “How to determine the volume of a flask”,Legend has it that T.A. Edison instructed the mathematician Epton to determine the volume of the lamp bulb. Epton completed the task in just over an hour and proudly showed off his calculations. Then Edison showed how to do the same thing in a minute and much more accurately. How?,https://www.trizland.ru/tasks/5049/
Problem 34. “Fresh fish from winter fishing”,"During winter fishing, caught fish are most often left on the ice. As a result, it freezes and the taste deteriorates. Suggest a way to preserve caught fish from freezing while fishing.",https://www.trizland.ru/tasks/1254/
Problem 38. “Fly on the ceiling”,"Each of us has seen a fly land on the ceiling more than once. She flies up to the ceiling, naturally, with her back up. However, how does she sit on the ceiling?",https://www.trizland.ru/tasks/1517/
Problem 39. “Is a camel hot in the heat?”,A camel can go without drinking for two weeks. What inventions of nature allow him to live for a long time without water? How does it minimize water consumption?,https://www.trizland.ru/tasks/1711/
Problem 40. “Algae in Antarctica?”,Antarctica region. Very cold. Thick ice and a thick layer of water. The light cannot penetrate to the bottom. But plants cannot live without light. But polar algae have adapted to such conditions. How?,https://www.trizland.ru/tasks/1710/
Problem 42. “Uninvited washermen”,"There is a washing machine in the hostel (as in the picture). And so strangers got into the habit of doing laundry in this machine. How to prevent them from doing this without making any changes to the design of the machine, using standard means that you can buy in a store.",https://www.trizland.ru/tasks/5051/
Problem 43. “Don’t get caught in your own network”,"The circular web of spiders has amazed more than one generation of scientists and artists with its form and practicality. It is also good from a technical point of view: a relatively large area is covered with the least amount of spider silk. At the same time, the net is elastic and at the same time strong: it can withstand gusts of wind and jerks from struggling prey. To securely hold the prey, the net must be sufficiently sticky. But how then does the spider running on the web not stick to its own trap?",https://www.trizland.ru/tasks/1258/
Problem 44. “How do they steal purebred dogs?”,"Purebred dogs are expensive. Everyone knows this. Crooks too. They steal dogs, often during walks, when the owner can let his dog go for a walk without a leash. In what ways can a dog that the owner let go for a walk be taken away?",https://www.trizland.ru/tasks/1259/
Problem 45. “Hull – in half”,"Sometimes small things lead to serious accidents. For example, in the history of maritime disasters there is a curious case. The ship carrying peas received a small hole. Only one compartment of the hold was flooded, which did not pose a danger. However, this ship sank - the ship's hull was torn in half. And the reason for this was this small hole. Can you restore the situation and find out what happened and how?",https://www.trizland.ru/tasks/1813/
Problem 49. Catch a big and very big fish,"When fishing commercially, fishermen cast a trawl and a lot of fish fall into it. But full nets under water are not yet a catch. While the nets are being lifted, half of the fish caught in the net manage to escape. How can you prevent fish from escaping without complicating your net?",https://www.trizland.ru/tasks/1635/
Problem 50. Catch a curious fish...,"Humanity invented nets and fishing rods not very long ago. And before that, of course, they weren’t abandoned. How did Stone Age people fish in the coastal zone of the sea without nets and fishing rods?",https://www.trizland.ru/tasks/1636/
Problem 51. “Naked in winter”,"For living beings, warm winter shoes are a natural phenomenon. Another surprising thing is that some animals and birds do not start anything for themselves before winter. Take a closer look at the pigeons, what are they wearing as they splash around in the snow? Of course, the skin on the paws is much thicker than on other parts of the body, and is also covered with scales. But such skin cannot save you from the cold. How do birds dressed so frivolously manage to safely endure harsh winters?",https://www.trizland.ru/tasks/1638/
Problem 55. “How a sparrow flies”,"How do sparrows fly in a very strong wind, considering that this bird does not fly, but jumps along the trajectory of its flight? They cannot stay in flight for long, because the heart cannot stand it - it will “break.” An example of this weakness is very well known when China tried to get rid of sparrows that were eating their rice crops. The birds were not allowed to land for a long time, and the sparrows fell dead. The question is - how can she move in a strong wind that blows her away? Just don’t say that on foot, there’s already been a joke about that!",https://www.trizland.ru/tasks/5053/
Problem 56. “Is the painting a fake?”,"An Austrian museum decided to buy a painting by a famous artist in France. Its authenticity was confirmed by competent experts. In their presence, the notary put a stamp on the back of the canvas, certifying its authenticity. In the Austrian museum, where it was delivered with all precautions, they carried out a second examination, and it turned out that the painting was a fake! Detectives analyzed the situation. It turned out that a group of French experts correctly determined that the painting was original. The notary's seal was also not copied. How did the substitution occur? Any versions?",https://www.trizland.ru/tasks/1779/
Problem 57. “Lizard into the ground”,"Speed ​​at the moment of danger is the most important quality for a potential victim. In most cases, life depends on speed. The round-headed lizard quickly buries itself in the ground when in danger. How does it do this? Offer your options.",https://www.trizland.ru/tasks/1709/
Problem 58. “Asphalt road without bitumen”,"Asphalt consists mainly of sand and bitumen. Bitumen (similar to black tar) is one of the products that is obtained from petroleum. To build one kilometer of asphalt road, the amount of bitumen required is equal to that produced from 320 barrels of oil. Oil is expensive. And if you need to build, for example, 87 thousand kilometers of asphalt roads, the cost of bitumen will cost a pretty penny. Bitumen has another undesirable effect: this material is dangerous for the environment. How else can grains of sand be bonded together to get a cheap and an asphalt-like road surface that is safe for nature? Suggest a solution.",https://www.trizland.ru/tasks/5054/
Problem 62. The Gardener's Revenge ,"In the garden of a certain sage there lived a magnificent peacock. The bird was the gardener's delight. He nurtured and cherished her. And the envious and greedy neighbor still could not come to terms with the fact that someone had a peacock more beautiful than his. Out of envy, he threw stones at the bird. The gardener saw this and became very angry. But the neighbor decided to flatter the gardener and asked him to give him one chick. The gardener flatly refused. Then the neighbor humbly turned to the owner with a request to give one peacock egg to put on the hen, and she would hatch the chick. The owner asked the gardener to give his neighbor an egg from a peacock clutch. The gardener complied with the command. After some time, an angry neighbor came to the owner with a complaint: “There is something wrong with the egg, my hens sat on it for weeks, but the chick did not hatch.” The owner called the gardener: “You gave our neighbor an egg. Why didn’t a peacock chick hatch from it?” What happened?",https://www.trizland.ru/tasks/1780/
Problem 64. “How to detect a submarine?”,"Enemy submarines impudently plow the waters of our Motherland. Hiding in the water column, they are practically invisible and undetectable. Help your Motherland and suggest ways to detect submarines.",https://www.trizland.ru/tasks/1264/
Problem 65. “Match equation”,Rearrange one match so that it is equal.,https://www.trizland.ru/tasks/5055/
Problem 66. “Do not spoil the mycelium”,"The basic rule when picking mushrooms is not to disturb the mycelium. If you cut it with a knife, the base of the stem remains in the ground, which means that the remaining part can rot and spoil the mycelium. What should I do?",https://www.trizland.ru/tasks/1265/
Problem 68. “Wet goose?”,"Australian naturalist K. Lorenz conducted an experiment: he took goslings that had just hatched from eggs in an incubator, and began to walk with them instead of the goose. It turned out that the feathers of goslings left without a mother get wet in water, while the feathers of goslings with their mother do not get wet. Why? What experiments need to be carried out to test the hypotheses obtained? Lorenz tried to lubricate the goslings with fat, but this did not help much.",https://www.trizland.ru/tasks/1267/
Problem 70. Escape of the ostriches ,"At the end of the 19th century, Karl Hagenbeck supplied all zoos in Europe with wild animals. They were often led in a caravan containing various animals. Once ostriches escaped from such a caravan, but they were returned. And without any problems - without re-capture. How? Offer your options.",https://www.trizland.ru/tasks/1269/
Problem 71. “Elephant Hunting”,"Elephant hunting is carried out only by experienced hunters who can act in a coordinated manner. If an elephant is surrounded, it violently rushes at the hunters. And the object of attack is usually a light-colored horse (especially a gray one), on which one of the hunters is riding. Why?",https://www.trizland.ru/tasks/1270/
Problem 72. “Why is he so curly?”,Why do Africans have such curly hair? Any hypotheses?,https://www.trizland.ru/tasks/1271/
Problem 73. Goose bumps,Why do people get goose bumps? What happens in the human body?,https://www.trizland.ru/tasks/1272/
Problem 74. “On the happiness of having two wives”,"One sheikh achieved the highest happiness on earth: he had two wives. Filled with joy, he went to the market and bought two identical gold necklaces and presented them to his wives, asking each not to tell the other about it. But earthly happiness is rarely cloudless. One fine day, both wives came to him, beside themselves with jealousy, and attacked him with questions: “Tell us, most magnificent of men, which of us do you love most?” “My dears, more than anything in the world I love you,” the sheikh answered, trying to calm them down. “No, no,” the wives protested. “We want to know which of the two of us you give your greatest love to?” “My adored ones, why are you quarreling?” I enclosed you both in my heart. But this was not enough for the wives. “You won’t get rid of us like that.” Come on, admit it, which of us is the mistress of your heart? What should a wise sheikh do?",https://www.trizland.ru/tasks/1781/
Problem 75. “Riot of the horse”,"That was a long time ago. In one village, one man took revenge on his offender: his horse did not want to enter his yard. During the civil war in Siberia, local residents used a similar method to get rid of punitive raids. What kind of method is this?",https://www.trizland.ru/tasks/1273/
Problem 77. “The most interesting exhibit”,"In one large European museum - many halls, many exhibits - they decided to check which exhibits attract the attention of visitors the most? How to do this without resorting to the help of outside experts? Offer options.",https://www.trizland.ru/tasks/5056/
Problem 78. “Children don’t go for a walk in Africa”,"A travel agency with a narrow specialization - exotic tours to the wild African jungle - was faced with a problem. Attracted by the unusual journey, the groups included people who had never gone anywhere except for a picnic in the company of office colleagues. During the trip, instead of relaxation and adventure, they received only fears and nervous breakdowns. This created inconvenience for both the organizers and other tourists. It would be good to know in advance how a person will behave in a wild environment. But how to do that?",https://www.trizland.ru/tasks/5057/
Problem 79. Dishwasher Dog,"When the Quonab Indian thought it was necessary to wash the dishes, he put them on the ground and let his dog Skookum lick them. This method completely satisfied Quoneb and delighted the dog, but the 12-year-old boy Rolf did not like it. However, the Indian told him: “Skookum eats the same food as we do.” You argue because you don’t understand anything. Rolf was washing the dishes “washed” by the dog, and Quonab’s uncleanliness irritated him. How can you make sure that the Indian himself never lets the dog lick the dishes again?",https://www.trizland.ru/tasks/1782/
